{
  "id": "task-azure-cli",
  "version": "1.0",
  "enabled": true,
  "description": "Run a Microsoft Azure CLI (`az`) command with auth-context awareness and operation-class detection. Refuses destructive commands unless dryRun=false is explicit.",
  "triggers": [
    {
      "eventType": "azure_command_request",
      "minConfidence": 0.6,
      "platforms": ["any"]
    },
    {
      "eventType": "az_command_request",
      "minConfidence": 0.6,
      "platforms": ["any"]
    }
  ],
  "entry": "scripts/az_wrapper.py",
  "runtime": "py",
  "inputs": [
    {
      "name": "args",
      "type": "array",
      "required": true,
      "description": "argv tail to pass to az, e.g. [\"vm\", \"list\"]. The literal `az` is prepended by the skill."
    },
    {
      "name": "dryRun",
      "type": "boolean",
      "required": false,
      "default": true,
      "description": "If true (default), classifies + reports the command without executing. Set false to actually run."
    },
    {
      "name": "timeoutSeconds",
      "type": "number",
      "required": false,
      "default": 60,
      "description": "Hard cap on the az call."
    }
  ],
  "outputs": [
    {
      "name": "installed",
      "type": "boolean",
      "description": "True iff `az --version` succeeded."
    },
    {
      "name": "authenticated",
      "type": "boolean",
      "description": "True iff `az account show` returned an active subscription."
    },
    {
      "name": "subscription",
      "type": "string",
      "description": "Name of the active subscription, or empty."
    },
    {
      "name": "tenant",
      "type": "string",
      "description": "Active tenant ID, or empty."
    },
    {
      "name": "operationClass",
      "type": "string",
      "description": "read | mutate | destroy"
    },
    {
      "name": "executed",
      "type": "boolean"
    },
    {
      "name": "stdout",
      "type": "string"
    },
    {
      "name": "stderr",
      "type": "string"
    },
    {
      "name": "exitCode",
      "type": "number"
    },
    {
      "name": "refusalReason",
      "type": "string"
    }
  ],
  "reversibility": 0.7,
  "permissions": ["process:read", "process:execute"],
  "timeoutMs": 90000,
  "settings": {}
}
